{
  "$schema": "https://json-schema.org/draft/2020-12/schema",
  "$id": "https://github.com/steueranwalt/taxcompliance/DE/AO/ustzustv-laendertabelle.schema.json",
  "title": "UStZustV-Laendertabelle: zentrale Umsatzsteuer-Zustaendigkeit fuer im Ausland ansaessige Unternehmer",
  "description": "Maschinenlesbare Laender-zu-Finanzamt-Zuordnung nach der Umsatzsteuerzustaendigkeitsverordnung (UStZustV), fuer im Ausland ansaessige Unternehmer ohne inlaendische Betriebsstaette. Siehe ustzustv-laendertabelle.json fuer den aktuellen Befuellungsstatus (zum Zeitpunkt der Anlage dieser Datei bewusst nicht befuellt, siehe dortiger Hinweis).",
  "type": "object",
  "required": ["schema_version", "stand", "befuellungsstatus", "quelle_verordnung", "zuordnungen"],
  "additionalProperties": false,
  "properties": {
    "schema_version": { "type": "string" },
    "stand": { "type": "string", "format": "date" },
    "befuellungsstatus": {
      "type": "string",
      "description": "'nicht befuellt' oder 'befuellt (Rechtsstand <Datum>)'."
    },
    "hinweis": {
      "description": "Erlaeuterungstext, als Array von Zeilen oder als einzelner String.",
      "oneOf": [
        { "type": "array", "items": { "type": "string" } },
        { "type": "string" }
      ]
    },
    "quelle_verordnung": { "type": "string" },
    "zuordnungen": {
      "type": "array",
      "items": { "$ref": "#/$defs/zuordnung" }
    }
  },
  "$defs": {
    "zuordnung": {
      "type": "object",
      "required": ["land", "finanzamt_name", "rechtsstand", "fundstelle"],
      "additionalProperties": false,
      "properties": {
        "land": {
          "type": "string",
          "description": "Staatenname, konsistent mit den Choice-Werten von tax_office_country in New-SteuerlicheErfassungListen.ps1, soweit zutreffend."
        },
        "finanzamt_name": { "type": "string" },
        "finanzamt_anschrift": { "type": "string" },
        "rechtsstand": {
          "type": "string",
          "format": "date",
          "description": "Datum, zu dem diese einzelne Zuordnung zuletzt gegen die aktuelle UStZustV-Anlage geprueft wurde."
        },
        "fundstelle": {
          "type": "string",
          "description": "Konkrete Fundstelle der herangezogenen UStZustV-Fassung/Anlage (nur Referenz, keine Wiedergabe von Kommentartexten)."
        },
        "anmerkung": { "type": "string" }
      }
    }
  }
}
